{"run_quality_evaluation_id":"rqe_fixture","run_id":"run_fixture","policy_snapshot_id":"psn_fixture","evaluated_at":"2026-07-28T00:00:00Z","evaluator_identities":["research-run-evaluator","research-friction-evaluator"],"run_outcome":"completed","correctness_risk_findings":[],"coverage_assessment":{"score":1,"rationale":"Complete fixture coverage."},"citation_assessment":{"score":1,"rationale":"Fixture citation is anchored."},"source_fitness_assessment":{"score":1,"rationale":"Fixture source is primary."},"derivation_assessment":{"score":1,"rationale":"No derivation."},"calibration_assessment":{"score":1,"rationale":"Confidence matches evidence."},"usefulness_assessment":{"score":1,"rationale":"Fixture is useful."},"friction_assessment":{"score":1,"rationale":"No fixture friction."},"deterministic_signals":{"pre_persistence_valid":true},"evaluator_uncertainty":0,"overall_disposition":"eligible","generated_lesson_ids":["les_fixture"]}
